module,intent,question,answer,combined
Desludging Service,16. intent,How are vehicles registered in the Desludging Service?,Registration of the Vehicles is done using a data entry form at the front end by the states in the Desludging Service.,[Desludging Service] Q: How are vehicles registered in the Desludging Service? A: Registration of the Vehicles is done using a data entry form at the front end by the states in the Desludging Service.
Desludging Service,17. intent,How are drivers registered in the Desludging Service?,Registration of the drivers is done using a data entry form at the front end by the states in the Desludging Service.,[Desludging Service] Q: How are drivers registered in the Desludging Service? A: Registration of the drivers is done using a data entry form at the front end by the states in the Desludging Service.
Desludging Service,18. intent,What measures are taken to protect sensitive data in the Desludging Service?,Protection of sensitive data is ensured in the Desludging Service.,[Desludging Service] Q: What measures are taken to protect sensitive data in the Desludging Service? A: Protection of sensitive data is ensured in the Desludging Service.
Desludging Service,19. intent,What changes can be made to a document in the Desludging Service?,"Changes can be made to a document in the Desludging Service, including adding details of citizens, such as dimensions and trips.","[Desludging Service] Q: What changes can be made to a document in the Desludging Service? A: Changes can be made to a document in the Desludging Service, including adding details of citizens, such as dimensions and trips."
Desludging Service,20. intent,Who can assign a PSSO in the Desludging Service?,A PSSO can be assigned in the Desludging Service.,[Desludging Service] Q: Who can assign a PSSO in the Desludging Service? A: A PSSO can be assigned in the Desludging Service.
Desludging Service,validation_rule,What are the conditions under which a PSSO approval is required for a desludging request?,Approval is required when a desludging request is submitted.,[Desludging Service] Q: What are the conditions under which a PSSO approval is required for a desludging request? A: Approval is required when a desludging request is submitted.
Desludging Service,process,What is the responsibility of the PSSO in the vehicle assignment process?,The PSSO is responsible for assigning a vehicle to a desludging request.,[Desludging Service] Q: What is the responsibility of the PSSO in the vehicle assignment process? A: The PSSO is responsible for assigning a vehicle to a desludging request.
Desludging Service,process,What is the role of the PSSO in updating trip schedules for desludging requests?,The PSSO updates trip schedules as per the requirements of the desludging request.,[Desludging Service] Q: What is the role of the PSSO in updating trip schedules for desludging requests? A: The PSSO updates trip schedules as per the requirements of the desludging request.
Desludging Service,rejection_reason,What are the circumstances under which a PSSO can be reassigned to another PSSO?,A PSSO can be reassigned if their request has been rejected or declined.,[Desludging Service] Q: What are the circumstances under which a PSSO can be reassigned to another PSSO? A: A PSSO can be reassigned if their request has been rejected or declined.
Desludging Service,process,What is the authority of the PSSO in updating and rescheduling trips for desludging requests?,The PSSO has the authority to update and reschedule trips as needed.,[Desludging Service] Q: What is the authority of the PSSO in updating and rescheduling trips for desludging requests? A: The PSSO has the authority to update and reschedule trips as needed.
Desludging Service,document_requirement,What information must be recorded by the plant operator in the vehicle log entry?,"The plant operator must record Vehicle No., PSSO Name, Locality, Septage dumped, Trips, in and out time, comments, and any supporting documents.","[Desludging Service] Q: What information must be recorded by the plant operator in the vehicle log entry? A: The plant operator must record Vehicle No., PSSO Name, Locality, Septage dumped, Trips, in and out time, comments, and any supporting documents."
Desludging Service,process,What is the purpose of mapping FSTP/STP with ULBs or villages?,The purpose is to cater to the demand of Urban Rural Convergence and to map villages with Rural FSTP/STP.,[Desludging Service] Q: What is the purpose of mapping FSTP/STP with ULBs or villages? A: The purpose is to cater to the demand of Urban Rural Convergence and to map villages with Rural FSTP/STP.
Desludging Service,sla,What metrics are used to measure the performance of the desludging service on the dashboard?,"The metrics include Total Requests, Total Sludge Treated, Average Desludging Service Cost, This FY Collection till Date, SLA Compliance, Average Citizen Rating, Top 3 Performing States, Bottom 3 Performing States, Desludging Service Collection By Usage Type, FSTP - Capacity Utilization, Monthly Septage Collected, and Total Cumulative Collection.","[Desludging Service] Q: What metrics are used to measure the performance of the desludging service on the dashboard? A: The metrics include Total Requests, Total Sludge Treated, Average Desludging Service Cost, This FY Collection till Date, SLA Compliance, Average Citizen Rating, Top 3 Performing States, Bottom 3 Performing States, Desludging Service Collection By Usage Type, FSTP - Capacity Utilization, Monthly Septage Collected, and Total Cumulative Collection."
Desludging Service,document_requirement,What type of reports are available for the desludging service?,Desludging reports are available.,[Desludging Service] Q: What type of reports are available for the desludging service? A: Desludging reports are available.
Desludging Service,process,What is the purpose of adding a QR code feature to the desludging service?,"The purpose is to store citizen data and allow for easy re-submission of requests without re-entering data, facilitating periodic desludging.","[Desludging Service] Q: What is the purpose of adding a QR code feature to the desludging service? A: The purpose is to store citizen data and allow for easy re-submission of requests without re-entering data, facilitating periodic desludging."
NMAM - Compliant Municipal Finance and Accounting,answer,validation_rule,"The mode of collection for remittances is determined by the configurable settings in the system, allowing for flexibility in payment processing.","[NMAM - Compliant Municipal Finance and Accounting] Q: validation_rule A: The mode of collection for remittances is determined by the configurable settings in the system, allowing for flexibility in payment processing."
NMAM - Compliant Municipal Finance and Accounting,answer,validation_rule,"Budget re-appropriations allow for the reallocation of funds within a budget, enabling the municipality to adapt to changing financial circumstances.","[NMAM - Compliant Municipal Finance and Accounting] Q: validation_rule A: Budget re-appropriations allow for the reallocation of funds within a budget, enabling the municipality to adapt to changing financial circumstances."
NMAM - Compliant Municipal Finance and Accounting,answer,validation_rule,"The capitalization of an asset is triggered when the asset's cost exceeds a predetermined threshold, as specified in the system's configuration.","[NMAM - Compliant Municipal Finance and Accounting] Q: validation_rule A: The capitalization of an asset is triggered when the asset's cost exceeds a predetermined threshold, as specified in the system's configuration."
NMAM - Compliant Municipal Finance and Accounting,answer,validation_rule,"Contra entries are used to record the offsetting of transactions, ensuring that the financial records accurately reflect the municipality's financial position.","[NMAM - Compliant Municipal Finance and Accounting] Q: validation_rule A: Contra entries are used to record the offsetting of transactions, ensuring that the financial records accurately reflect the municipality's financial position."
NMAM - Compliant Municipal Finance and Accounting,answer,validation_rule,"Statutory deductions are mandatory, as required by law, whereas non-statutory deductions are optional and may be imposed by the municipality.","[NMAM - Compliant Municipal Finance and Accounting] Q: validation_rule A: Statutory deductions are mandatory, as required by law, whereas non-statutory deductions are optional and may be imposed by the municipality."
NMAM - Compliant Municipal Finance and Accounting,answer,validation_rule,"The functional requirements outline the system's capabilities and functionalities, ensuring that it meets the municipality's financial management needs.","[NMAM - Compliant Municipal Finance and Accounting] Q: validation_rule A: The functional requirements outline the system's capabilities and functionalities, ensuring that it meets the municipality's financial management needs."
NMAM - Compliant Municipal Finance and Accounting,answer,validation_rule,"Configuring masters allows the municipality to customize the system's settings, ensuring that it accurately reflects their financial management practices.","[NMAM - Compliant Municipal Finance and Accounting] Q: validation_rule A: Configuring masters allows the municipality to customize the system's settings, ensuring that it accurately reflects their financial management practices."
NMAM - Compliant Municipal Finance and Accounting,answer,validation_rule,"Detailed codes enable the municipality to categorize and track financial transactions accurately, facilitating financial analysis and reporting.","[NMAM - Compliant Municipal Finance and Accounting] Q: validation_rule A: Detailed codes enable the municipality to categorize and track financial transactions accurately, facilitating financial analysis and reporting."
NMAM - Compliant Municipal Finance and Accounting,answer,validation_rule,"Viewing and modifying deductions allows the municipality to monitor and adjust their deduction policies, ensuring compliance with statutory requirements and internal policies.","[NMAM - Compliant Municipal Finance and Accounting] Q: validation_rule A: Viewing and modifying deductions allows the municipality to monitor and adjust their deduction policies, ensuring compliance with statutory requirements and internal policies."
NMAM - Compliant Municipal Finance and Accounting,answer,validation_rule,Viewing and modifying contractor information enables the municipality to accurately track payments and maintain a record of their contractual obligations.,[NMAM - Compliant Municipal Finance and Accounting] Q: validation_rule A: Viewing and modifying contractor information enables the municipality to accurately track payments and maintain a record of their contractual obligations.
NMAM - Compliant Municipal Finance and Accounting,answer,validation_rule,Viewing and modifying supplier information allows the municipality to accurately track payments and maintain a record of their procurement activities.,[NMAM - Compliant Municipal Finance and Accounting] Q: validation_rule A: Viewing and modifying supplier information allows the municipality to accurately track payments and maintain a record of their procurement activities.
NMAM - Compliant Municipal Finance and Accounting,answer,validation_rule,Viewing and modifying fund information enables the municipality to accurately track financial transactions and maintain a record of their financial resources.,[NMAM - Compliant Municipal Finance and Accounting] Q: validation_rule A: Viewing and modifying fund information enables the municipality to accurately track financial transactions and maintain a record of their financial resources.
NMAM - Compliant Municipal Finance and Accounting,answer,validation_rule,Viewing and modifying scheme and sub-scheme information allows the municipality to accurately track financial transactions and maintain a record of their programmatic activities.,[NMAM - Compliant Municipal Finance and Accounting] Q: validation_rule A: Viewing and modifying scheme and sub-scheme information allows the municipality to accurately track financial transactions and maintain a record of their programmatic activities.
NMAM - Compliant Municipal Finance and Accounting,answer,validation_rule,Viewing and modifying function information enables the municipality to accurately track financial transactions and maintain a record of their organizational activities.,[NMAM - Compliant Municipal Finance and Accounting] Q: validation_rule A: Viewing and modifying function information enables the municipality to accurately track financial transactions and maintain a record of their organizational activities.
NMAM - Compliant Municipal Finance and Accounting,answer,validation_rule,"Viewing and modifying subledger configuration allows the municipality to customize the system's settings, ensuring that it accurately reflects their financial management practices.","[NMAM - Compliant Municipal Finance and Accounting] Q: validation_rule A: Viewing and modifying subledger configuration allows the municipality to customize the system's settings, ensuring that it accurately reflects their financial management practices."
NMAM - Compliant Municipal Finance and Accounting,answer,validation_rule,Viewing and modifying bank information enables the municipality to accurately track financial transactions and maintain a record of their banking activities.,[NMAM - Compliant Municipal Finance and Accounting] Q: validation_rule A: Viewing and modifying bank information enables the municipality to accurately track financial transactions and maintain a record of their banking activities.
NMAM - Compliant Municipal Finance and Accounting,answer,validation_rule,Viewing and modifying purchase order information allows the municipality to accurately track procurement activities and maintain a record of their contractual obligations.,[NMAM - Compliant Municipal Finance and Accounting] Q: validation_rule A: Viewing and modifying purchase order information allows the municipality to accurately track procurement activities and maintain a record of their contractual obligations.
NMAM - Compliant Municipal Finance and Accounting,answer,validation_rule,Viewing and modifying work order information enables the municipality to accurately track project activities and maintain a record of their operational activities.,[NMAM - Compliant Municipal Finance and Accounting] Q: validation_rule A: Viewing and modifying work order information enables the municipality to accurately track project activities and maintain a record of their operational activities.
NMAM - Compliant Municipal Finance and Accounting,answer,validation_rule,"Transactions enable the municipality to record financial events, such as payments and receipts, and maintain a record of their financial activities.","[NMAM - Compliant Municipal Finance and Accounting] Q: validation_rule A: Transactions enable the municipality to record financial events, such as payments and receipts, and maintain a record of their financial activities."
E-Waste Management,answer,validation_rule,Citizen must have successfully registered and authenticated to access their personalized profile.,[E-Waste Management] Q: validation_rule A: Citizen must have successfully registered and authenticated to access their personalized profile.
E-Waste Management,answer,process,The primary purpose of the E-Waste Collection Request feature is to enable citizens to request the collection of e-waste from their households.,[E-Waste Management] Q: process A: The primary purpose of the E-Waste Collection Request feature is to enable citizens to request the collection of e-waste from their households.
E-Waste Management,answer,document_requirement,"Citizens can add the following products to their E-Waste Collection Request: AC, CPU, VGA Cable, Wires, Monitor, Keyboard, I Phone, Mouse, Printer, Power Cable, Scanner, etc.","[E-Waste Management] Q: document_requirement A: Citizens can add the following products to their E-Waste Collection Request: AC, CPU, VGA Cable, Wires, Monitor, Keyboard, I Phone, Mouse, Printer, Power Cable, Scanner, etc."
E-Waste Management,answer,comparison,"The quantity of products provided by the citizen affects the price of the E-Waste Collection Request, which will change accordingly.","[E-Waste Management] Q: comparison A: The quantity of products provided by the citizen affects the price of the E-Waste Collection Request, which will change accordingly."
E-Waste Management,answer,process,The price of the E-Waste Collection Request is calculated automatically based on the product selection.,[E-Waste Management] Q: process A: The price of the E-Waste Collection Request is calculated automatically based on the product selection.
E-Waste Management,answer,document_requirement,There is no maximum limit on the number of products that can be added to a single E-Waste Collection Request.,[E-Waste Management] Q: document_requirement A: There is no maximum limit on the number of products that can be added to a single E-Waste Collection Request.
E-Waste Management,answer,process,"Citizens can remove products from their E-Waste Collection Request by selecting the ""Remove"" option.","[E-Waste Management] Q: process A: Citizens can remove products from their E-Waste Collection Request by selecting the ""Remove"" option."
E-Waste Management,answer,document_requirement,"Citizens must provide the following information to complete the Owners Information Form: Full Name, Contact Number, Locality, Vendor, and Address details.","[E-Waste Management] Q: document_requirement A: Citizens must provide the following information to complete the Owners Information Form: Full Name, Contact Number, Locality, Vendor, and Address details."
E-Waste Management,answer,document_requirement,The Owners Full Name field must be filled in.,[E-Waste Management] Q: document_requirement A: The Owners Full Name field must be filled in.
E-Waste Management,answer,document_requirement,The Owners Contact Number field must be a valid mobile number.,[E-Waste Management] Q: document_requirement A: The Owners Contact Number field must be a valid mobile number.
E-Waste Management,answer,document_requirement,The Locality field must be filled in.,[E-Waste Management] Q: document_requirement A: The Locality field must be filled in.
E-Waste Management,answer,document_requirement,Additional address details are optional.,[E-Waste Management] Q: document_requirement A: Additional address details are optional.
E-Waste Management,answer,process,Citizens must choose a listed/empanelled vendor from the available options.,[E-Waste Management] Q: process A: Citizens must choose a listed/empanelled vendor from the available options.
E-Waste Management,answer,process,"A ""Request ID"" or ""Application Number"" will be generated after submitting the Owners Information Form.","[E-Waste Management] Q: process A: A ""Request ID"" or ""Application Number"" will be generated after submitting the Owners Information Form."
E-Waste Management,answer,document_requirement,"The Request List page displays the following information: Request qID/Application Number, Quantity, Amount, Date of Creation, and Status.","[E-Waste Management] Q: document_requirement A: The Request List page displays the following information: Request qID/Application Number, Quantity, Amount, Date of Creation, and Status."
E-Waste Management,answer,process,A pop-up window will appear with additional details.,[E-Waste Management] Q: process A: A pop-up window will appear with additional details.
E-Waste Management,answer,process,The Vendor Login feature allows vendors to check orders received from citizens or departments.,[E-Waste Management] Q: process A: The Vendor Login feature allows vendors to check orders received from citizens or departments.
E-Waste Management,answer,document_requirement,"The Orders page displays the following information: Request ID/Application ID, Quantity, Total Amount, Date of creation, Status, and an Action button.","[E-Waste Management] Q: document_requirement A: The Orders page displays the following information: Request ID/Application ID, Quantity, Total Amount, Date of creation, Status, and an Action button."
E-Waste Management,answer,document_requirement,"The following action buttons are available for vendors: View more information, Verify Product, and Send Pick-up Alert.","[E-Waste Management] Q: document_requirement A: The following action buttons are available for vendors: View more information, Verify Product, and Send Pick-up Alert."
E-Waste Management,answer,document_requirement,The View More Information pop-up screen displays the product details list and contact information with the Request ID or Application Number.,[E-Waste Management] Q: document_requirement A: The View More Information pop-up screen displays the product details list and contact information with the Request ID or Application Number.
