module,intent,question,answer,combined
Desludging Service,2. intent,What is the purpose of digitizing the desludging service lifecycle?,"process	To streamline the desludging service lifecycle from request to disposal, eliminating the current manual process.","[Desludging Service] Q: What is the purpose of digitizing the desludging service lifecycle? A: process	To streamline the desludging service lifecycle from request to disposal, eliminating the current manual process."
Desludging Service,3. intent,"What are the safety protocols for the collection, transportation, and disposal of faecal sludge?","validation_rule	The collection, transportation, and disposal of faecal sludge must be done at authorized FSTP/STP facilities to ensure safe disposal.","[Desludging Service] Q: What are the safety protocols for the collection, transportation, and disposal of faecal sludge? A: validation_rule	The collection, transportation, and disposal of faecal sludge must be done at authorized FSTP/STP facilities to ensure safe disposal."
Desludging Service,4. intent,"What features should a seamless, transparent, and user-friendly interface for citizens and Urban Local Bodies (ULBs) include?","document_requirement	A seamless, transparent, and user-friendly interface for citizens and ULBs should include features such as online application submission, schedule desludging operation, and updating vehicle entry in the FSTP/STP plant.","[Desludging Service] Q: What features should a seamless, transparent, and user-friendly interface for citizens and Urban Local Bodies (ULBs) include? A: document_requirement	A seamless, transparent, and user-friendly interface for citizens and ULBs should include features such as online application submission, schedule desludging operation, and updating vehicle entry in the FSTP/STP plant."
Desludging Service,5. intent,"What metrics should be tracked for efficient monitoring, tracking, and reporting of desludging operations?","document_requirement	Efficient monitoring, tracking, and reporting of desludging operations should include metrics such as desludging operation schedule, vehicle entry in the FSTP/STP plant, and reporting and dashboards.","[Desludging Service] Q: What metrics should be tracked for efficient monitoring, tracking, and reporting of desludging operations? A: document_requirement	Efficient monitoring, tracking, and reporting of desludging operations should include metrics such as desludging operation schedule, vehicle entry in the FSTP/STP plant, and reporting and dashboards."
Desludging Service,6. intent,What are the environmental and health benefits of proper waste management through the desludging service?,document_requirement	Proper waste management through the desludging service improves environmental sanitation and promotes public health by reducing the risk of waterborne diseases and environmental pollution.,[Desludging Service] Q: What are the environmental and health benefits of proper waste management through the desludging service? A: document_requirement	Proper waste management through the desludging service improves environmental sanitation and promotes public health by reducing the risk of waterborne diseases and environmental pollution.
Desludging Service,7. intent,What is the purpose of reducing manual intervention and enhancing accountability via role-based workflows?,"process	To reduce manual intervention and enhance accountability via role-based workflows, ensuring that each user has a clear role and responsibility in the desludging service process.","[Desludging Service] Q: What is the purpose of reducing manual intervention and enhancing accountability via role-based workflows? A: process	To reduce manual intervention and enhance accountability via role-based workflows, ensuring that each user has a clear role and responsibility in the desludging service process."
Desludging Service,8. intent,What data should be available for data-driven decision-making through dashboards and analytics?,"document_requirement	Data available for data-driven decision-making through dashboards and analytics should include metrics such as desludging operation schedule, vehicle entry in the FSTP/STP plant, and reporting and dashboards.","[Desludging Service] Q: What data should be available for data-driven decision-making through dashboards and analytics? A: document_requirement	Data available for data-driven decision-making through dashboards and analytics should include metrics such as desludging operation schedule, vehicle entry in the FSTP/STP plant, and reporting and dashboards."
Desludging Service,9. intent,What is the purpose of enabling urban-rural convergence for desludging services?,"process	To enable urban-rural convergence for desludging services, ensuring that desludging services are accessible and available to both urban and rural areas.","[Desludging Service] Q: What is the purpose of enabling urban-rural convergence for desludging services? A: process	To enable urban-rural convergence for desludging services, ensuring that desludging services are accessible and available to both urban and rural areas."
Desludging Service,10. intent,What are the conditions for approval and rejection of desludging service applications?,"rejection_reason	Desludging service applications can be rejected if they are incomplete, do not meet the required standards, or are not submitted through the authorized channels.","[Desludging Service] Q: What are the conditions for approval and rejection of desludging service applications? A: rejection_reason	Desludging service applications can be rejected if they are incomplete, do not meet the required standards, or are not submitted through the authorized channels."
Desludging Service,11. intent,"What information should be configured for employees, desludging operators, city boundary details, users, user role, department designations, and city details?","document_requirement	Masters configurations for employees, desludging operators, city boundary details, users, user role, department designations, and city details should include information such as employee roles, desludging operator licenses, city boundary details, and user roles.","[Desludging Service] Q: What information should be configured for employees, desludging operators, city boundary details, users, user role, department designations, and city details? A: document_requirement	Masters configurations for employees, desludging operators, city boundary details, users, user role, department designations, and city details should include information such as employee roles, desludging operator licenses, city boundary details, and user roles."
Desludging Service,12. intent,What types of notifications should be sent to citizens and ULBs?,"document_requirement	Notifications should be sent to citizens and ULBs for events such as desludging operation schedule, vehicle entry in the FSTP/STP plant, and application submission status.","[Desludging Service] Q: What types of notifications should be sent to citizens and ULBs? A: document_requirement	Notifications should be sent to citizens and ULBs for events such as desludging operation schedule, vehicle entry in the FSTP/STP plant, and application submission status."
Desludging Service,13. intent,What are the options for submitting desludging service applications?,document_requirement	Desludging service applications can be submitted online by citizens and ULBs through the portal.,[Desludging Service] Q: What are the options for submitting desludging service applications? A: document_requirement	Desludging service applications can be submitted online by citizens and ULBs through the portal.
Desludging Service,14. intent,What is the process for scheduling desludging operations?,"process	The process for scheduling desludging operations involves submitting an application, scheduling the operation, and updating the vehicle entry in the FSTP/STP plant.","[Desludging Service] Q: What is the process for scheduling desludging operations? A: process	The process for scheduling desludging operations involves submitting an application, scheduling the operation, and updating the vehicle entry in the FSTP/STP plant."
Desludging Service,15. intent,What is the purpose of updating the vehicle entry in the FSTP/STP plant?,"process	To update the vehicle entry in the FSTP/STP plant, ensuring that the vehicle is properly registered and accounted for in the desludging operation.","[Desludging Service] Q: What is the purpose of updating the vehicle entry in the FSTP/STP plant? A: process	To update the vehicle entry in the FSTP/STP plant, ensuring that the vehicle is properly registered and accounted for in the desludging operation."
Desludging Service,16. intent,What metrics should be tracked for reporting and dashboards?,"document_requirement	Reporting and dashboards should include metrics such as desludging operation schedule, vehicle entry in the FSTP/STP plant, and application submission status.","[Desludging Service] Q: What metrics should be tracked for reporting and dashboards? A: document_requirement	Reporting and dashboards should include metrics such as desludging operation schedule, vehicle entry in the FSTP/STP plant, and application submission status."
Desludging Service,17. intent,What are the functional requirements for the desludging service module?,"document_requirement	The functional requirements for the desludging service module include features such as online application submission, schedule desludging operation, and updating vehicle entry in the FSTP/STP plant.","[Desludging Service] Q: What are the functional requirements for the desludging service module? A: document_requirement	The functional requirements for the desludging service module include features such as online application submission, schedule desludging operation, and updating vehicle entry in the FSTP/STP plant."
Desludging Service,18. intent,What are the list of functionalities for the desludging service module?,"document_requirement	The list of functionalities for the desludging service module includes features such as portal, data entry form, and reporting and dashboards.","[Desludging Service] Q: What are the list of functionalities for the desludging service module? A: document_requirement	The list of functionalities for the desludging service module includes features such as portal, data entry form, and reporting and dashboards."
Desludging Service,19. intent,What is the provision for citizens to make desludging requests online?,document_requirement	The provision for citizens to make desludging requests online includes features such as online application submission and schedule desludging operation.,[Desludging Service] Q: What is the provision for citizens to make desludging requests online? A: document_requirement	The provision for citizens to make desludging requests online includes features such as online application submission and schedule desludging operation.
Desludging Service,20. intent,What is the provision for States/UTs/Cities to enter data using a data entry form at the backend?,"document_requirement	The provision for States/UTs/Cities to enter data using a data entry form at the backend includes features such as data entry form, admin boundaries, and user roles mapping.","[Desludging Service] Q: What is the provision for States/UTs/Cities to enter data using a data entry form at the backend? A: document_requirement	The provision for States/UTs/Cities to enter data using a data entry form at the backend includes features such as data entry form, admin boundaries, and user roles mapping."
Desludging Service,1. intent,What are the language options available for first-time registration via the web portal?,Registration can be done in multiple languages during first-time registration via the web portal.,[Desludging Service] Q: What are the language options available for first-time registration via the web portal? A: Registration can be done in multiple languages during first-time registration via the web portal.
Desludging Service,2. validation_rule,What is the login method for citizens and counter employees via the web portal?,OTP-based login is required for citizens and counter employees via the web portal.,[Desludging Service] Q: What is the login method for citizens and counter employees via the web portal? A: OTP-based login is required for citizens and counter employees via the web portal.
Desludging Service,3. sla,How do different levels of employees access the system?,Login credentials are provided for various hierarchies of employees.,[Desludging Service] Q: How do different levels of employees access the system? A: Login credentials are provided for various hierarchies of employees.
Desludging Service,4. process,What information is available on a citizen's or counter employee's personalized profile?,A citizen's or counter employee's profile contains personalized information.,[Desludging Service] Q: What information is available on a citizen's or counter employee's personalized profile? A: A citizen's or counter employee's profile contains personalized information.
Desludging Service,5. process,Who can apply for desludging services?,"Call center executives, citizens, and counter employees can apply for desludging services.","[Desludging Service] Q: Who can apply for desludging services? A: Call center executives, citizens, and counter employees can apply for desludging services."
Desludging Service,6. validation_rule,Is a property ID required to apply for desludging services?,A property ID is required to be added by the citizen to mark the septic tank with prior information.,[Desludging Service] Q: Is a property ID required to apply for desludging services? A: A property ID is required to be added by the citizen to mark the septic tank with prior information.
Desludging Service,7. validation_rule,How are property types mapped in the system?,Different types of properties are mapped as per centralized master data common for all states.,[Desludging Service] Q: How are property types mapped in the system? A: Different types of properties are mapped as per centralized master data common for all states.
Desludging Service,8. validation_rule,How are property sub-types mapped in the system?,Different sub-types of properties are mapped as per centralized master data common for all states.,[Desludging Service] Q: How are property sub-types mapped in the system? A: Different sub-types of properties are mapped as per centralized master data common for all states.
Desludging Service,9. sla,How is property location pinned in the system?,Property location can be pinned using GIS integration with a centralized GIS provider at the central level.,[Desludging Service] Q: How is property location pinned in the system? A: Property location can be pinned using GIS integration with a centralized GIS provider at the central level.
Desludging Service,10. validation_rule,How are pincodes mapped in the system?,"Pincodes are mapped as per the ULBs, villages (GPs).","[Desludging Service] Q: How are pincodes mapped in the system? A: Pincodes are mapped as per the ULBs, villages (GPs)."
Desludging Service,11. validation_rule,What information can be provided for property address?,"Call center executives, citizens, and counter employees can provide property address information such as city, locality, zone, block, and villages (GPs).","[Desludging Service] Q: What information can be provided for property address? A: Call center executives, citizens, and counter employees can provide property address information such as city, locality, zone, block, and villages (GPs)."
Desludging Service,12. validation_rule,How are slum areas mapped in the system?,"Slum areas can be mapped, and states can provide exceptions and rebates based on state rules and by-laws.","[Desludging Service] Q: How are slum areas mapped in the system? A: Slum areas can be mapped, and states can provide exceptions and rebates based on state rules and by-laws."
Desludging Service,13. validation_rule,What information is required for property location?,"Property address information such as street name, door/house number, and location within ULB limits or Gram Panchayat is required.","[Desludging Service] Q: What information is required for property location? A: Property address information such as street name, door/house number, and location within ULB limits or Gram Panchayat is required."
Desludging Service,14. validation_rule,What information can be provided as a landmark?,"Call center executives, citizens, or counter employees can provide landmark information.","[Desludging Service] Q: What information can be provided as a landmark? A: Call center executives, citizens, or counter employees can provide landmark information."
Desludging Service,15. validation_rule,What information is required for road width?,Citizens must enter the road width to ensure the desludging/cesspool vehicle can be sent accordingly.,[Desludging Service] Q: What information is required for road width? A: Citizens must enter the road width to ensure the desludging/cesspool vehicle can be sent accordingly.
Desludging Service,16. validation_rule,What information is required for distance from the road?,Citizens must enter the distance from the road to the septic tank to ensure obstruction-free desludging.,[Desludging Service] Q: What information is required for distance from the road? A: Citizens must enter the distance from the road to the septic tank to ensure obstruction-free desludging.
Desludging Service,17. validation_rule,What types of pits can be chosen?,"Pit types such as conventional septic tanks, septic tanks with soak pits, etc. can be chosen.","[Desludging Service] Q: What types of pits can be chosen? A: Pit types such as conventional septic tanks, septic tanks with soak pits, etc. can be chosen."
Desludging Service,18. document_requirement,What type of documentation is required for pit photos?,Citizens can upload pit photos as documentation.,[Desludging Service] Q: What type of documentation is required for pit photos? A: Citizens can upload pit photos as documentation.
Desludging Service,19. process,What payment options are available for desludging services?,"Advance and final payments can be made by citizens, counter employees, or PSSOs.","[Desludging Service] Q: What payment options are available for desludging services? A: Advance and final payments can be made by citizens, counter employees, or PSSOs."
Desludging Service,20. process,Who can edit application details before submitting the application?,"Call center executives, counter employees, and citizens can edit application details before submitting the application.","[Desludging Service] Q: Who can edit application details before submitting the application? A: Call center executives, counter employees, and citizens can edit application details before submitting the application."
Desludging Service,1. intent,What triggers the generation of an acknowledgement form in the Desludging Service module?,An acknowledgement form is generated and can be downloaded in the pdf format when the service is initiated.,[Desludging Service] Q: What triggers the generation of an acknowledgement form in the Desludging Service module? A: An acknowledgement form is generated and can be downloaded in the pdf format when the service is initiated.
Desludging Service,2. intent,"Who is responsible for collecting payment for the Desludging Service when it is paid by cheque, cash, or demand draft?","Counter Employee is responsible for collecting payment for the Desludging Service when it is paid by cheque, cash, or demand draft.","[Desludging Service] Q: Who is responsible for collecting payment for the Desludging Service when it is paid by cheque, cash, or demand draft? A: Counter Employee is responsible for collecting payment for the Desludging Service when it is paid by cheque, cash, or demand draft."
Desludging Service,3. intent,"Who is responsible for collecting payment for the Desludging Service when it is paid online, via net banking, debit card, or credit card?","Citizen is responsible for collecting payment for the Desludging Service when it is paid online, via net banking, debit card, or credit card.","[Desludging Service] Q: Who is responsible for collecting payment for the Desludging Service when it is paid online, via net banking, debit card, or credit card? A: Citizen is responsible for collecting payment for the Desludging Service when it is paid online, via net banking, debit card, or credit card."
Desludging Service,4. intent,How can a citizen download receipts for payments made in the Desludging Service?,A citizen can download receipts for payments made in the Desludging Service through the Citizen/CSC portal.,[Desludging Service] Q: How can a citizen download receipts for payments made in the Desludging Service? A: A citizen can download receipts for payments made in the Desludging Service through the Citizen/CSC portal.
Desludging Service,5. intent,How can a citizen track the status of their application in the Desludging Service?,A citizen can track the status of their application in the Desludging Service through the 'My Application' feature.,[Desludging Service] Q: How can a citizen track the status of their application in the Desludging Service? A: A citizen can track the status of their application in the Desludging Service through the 'My Application' feature.
Desludging Service,6. intent,"Who can view the application timeline, including the status and comments, in the Desludging Service?","Citizen and Counter Employee can view the application timeline, including the status and comments, in the Desludging Service.","[Desludging Service] Q: Who can view the application timeline, including the status and comments, in the Desludging Service? A: Citizen and Counter Employee can view the application timeline, including the status and comments, in the Desludging Service."
Desludging Service,7. intent,What type of notification is available in the Desludging Service?,Notification is available in the Desludging Service.,[Desludging Service] Q: What type of notification is available in the Desludging Service? A: Notification is available in the Desludging Service.
Desludging Service,8. intent,What type of notification is sent to citizens in the Desludging Service?,SMS notification is sent to citizens at every step where the application is forwarded in the Desludging Service.,[Desludging Service] Q: What type of notification is sent to citizens in the Desludging Service? A: SMS notification is sent to citizens at every step where the application is forwarded in the Desludging Service.
Desludging Service,9. intent,How are rates configured for the Desludging Service in different ULBs and villages (GPs)?,There is a common configurable rate master for ULBs and villages (GPs) in the Desludging Service.,[Desludging Service] Q: How are rates configured for the Desludging Service in different ULBs and villages (GPs)? A: There is a common configurable rate master for ULBs and villages (GPs) in the Desludging Service.
Desludging Service,10. intent,How are charges and calculations configured for the Desludging Service at the state level?,There is a configurable Charges & Calculation at the state level using the Calculation Engine in the Desludging Service.,[Desludging Service] Q: How are charges and calculations configured for the Desludging Service at the state level? A: There is a configurable Charges & Calculation at the state level using the Calculation Engine in the Desludging Service.
Desludging Service,11. intent,What types of data are configured at the central level in the Desludging Service?,"There are common State Masters, including Property Ontology, Documents List, Employee Data Mapping, Boundary Data Mapping, and standard workflows, configured at the central level in the Desludging Service.","[Desludging Service] Q: What types of data are configured at the central level in the Desludging Service? A: There are common State Masters, including Property Ontology, Documents List, Employee Data Mapping, Boundary Data Mapping, and standard workflows, configured at the central level in the Desludging Service."
Desludging Service,12. intent,How is the verification and approval flow configured in the Desludging Service?,There is a common Configurable Verification & Approval flow at the central level in the Desludging Service.,[Desludging Service] Q: How is the verification and approval flow configured in the Desludging Service? A: There is a common Configurable Verification & Approval flow at the central level in the Desludging Service.
Desludging Service,13. intent,How are employees registered in the Desludging Service?,Registration of employees is done using a data entry form at the front end by the states in the Desludging Service.,[Desludging Service] Q: How are employees registered in the Desludging Service? A: Registration of employees is done using a data entry form at the front end by the states in the Desludging Service.
Desludging Service,14. intent,How are PSSOs registered in the Desludging Service?,Registration of the PSSOs is done using a data entry form at the front end by the states in the Desludging Service.,[Desludging Service] Q: How are PSSOs registered in the Desludging Service? A: Registration of the PSSOs is done using a data entry form at the front end by the states in the Desludging Service.
Desludging Service,15. intent,How are Municipal Owned Equipment (MOE) registered in the Desludging Service?,Registration of the Municipal Owned Equipment (MOE) is done using a data entry form at the front end by the states in the Desludging Service.,[Desludging Service] Q: How are Municipal Owned Equipment (MOE) registered in the Desludging Service? A: Registration of the Municipal Owned Equipment (MOE) is done using a data entry form at the front end by the states in the Desludging Service.
